{
  "canonical_revision": 0,
  "checkpoint_id": "11111111-1111-4111-8111-111111111111",
  "checkpoint_lsn": "0/16B6C50",
  "contract": "my-data-hub-checkpoint-manifest.v1",
  "created_at": "2026-08-10T00:00:00Z",
  "epoch": 1,
  "files": [
    {
      "byte_size": 1,
      "kind": "logical",
      "path": "logical/hub.dump",
      "sha256": "aaaaaaaaaaaaaaaaaaaaaaaaaaaaaaaaaaaaaaaaaaaaaaaaaaaaaaaaaaaaaaaa"
    },
    {
      "byte_size": 1,
      "kind": "postgres_backup_manifest",
      "path": "physical/backup_manifest",
      "sha256": "9999999999999999999999999999999999999999999999999999999999999999"
    },
    {
      "byte_size": 1,
      "kind": "physical",
      "path": "physical/base.tar.gz",
      "sha256": "bbbbbbbbbbbbbbbbbbbbbbbbbbbbbbbbbbbbbbbbbbbbbbbbbbbbbbbbbbbbbbbb"
    },
    {
      "byte_size": 1,
      "kind": "physical",
      "path": "physical/pg_wal.tar.gz",
      "sha256": "ffffffffffffffffffffffffffffffffffffffffffffffffffffffffffffffff"
    },
    {
      "byte_size": 1,
      "kind": "restore_smoke_receipt",
      "path": "receipts/restore-smoke.json",
      "sha256": "cccccccccccccccccccccccccccccccccccccccccccccccccccccccccccccccc"
    },
    {
      "byte_size": 1,
      "kind": "verification_receipt",
      "path": "receipts/verification.json",
      "sha256": "dddddddddddddddddddddddddddddddddddddddddddddddddddddddddddddddd"
    }
  ],
  "manifest_sha256": "0ca33539d3f6d31f01e996ee062fbd761af7cc0241ce8db83c16daf741e49b20",
  "master_instance_id": "22222222-2222-4222-8222-222222222222",
  "parent_checkpoint_id": null,
  "pgvector_version": "0.8.1",
  "postgres_version": "18.0",
  "restore_probe": {
    "canonical_revision": 0,
    "logical_hash_sha256": "eeeeeeeeeeeeeeeeeeeeeeeeeeeeeeeeeeeeeeeeeeeeeeeeeeeeeeeeeeeeeeee",
    "row_counts": {
      "hub.canonical_state": 1
    },
    "schema_version": 11
  },
  "schema_version": 11,
  "source_identity": "private-checkpoint-dataset/exact-version-1",
  "source_run_id": "master-run-example"
}
